{
  "ir_version": "cubeengine.rule-ir/2.0-alpha.1",
  "document_id": "rule:game.snake.game.with.python.and.pygame.source",
  "revision": 1,
  "content_hash": "edf1ad213ad04fa672c9e036b2b4263e43d260f2fcfd85e8eefdfc9681a358fe",
  "metadata": {
    "title": "Snake Game with Python and Pygame",
    "description": "LLM compiler bootstrap shell. Semantics must be filled by evidence-backed patches.",
    "source_project_hash": "6bbf008a8c81a818a748c0c6d58bb2457c311dc3efed88f516d073cecfbb756c",
    "determinism": "deterministic"
  },
  "dependencies": {
    "scene_ir": null,
    "asset_ir": null,
    "input_ir": null,
    "extensions": []
  },
  "parameters": [],
  "types": [],
  "participants": [
    {
      "id": "rule:participant.human.player",
      "name": "Player",
      "kind": "human"
    }
  ],
  "topologies": [
    {
      "id": "rule:topology.board",
      "kind": "rect_grid",
      "anchor": "cell",
      "axes": [
        {
          "name": "x",
          "extent": 20,
          "boundary": "bounded"
        },
        {
          "name": "y",
          "extent": 20,
          "boundary": "bounded"
        }
      ],
      "neighborhoods": [],
      "name": "Board"
    }
  ],
  "state": {
    "variables": [
      {
        "id": "rule:state.board_cell",
        "name": "Board Cell",
        "type": "core:int",
        "scope": "topology_site",
        "topology": "rule:topology.board",
        "initial_value": {
          "op": "literal",
          "value": 0
        },
        "initial": {
          "op": "literal",
          "value": 0
        }
      }
    ],
    "initial_effects": [
      {
        "op": "grid.set",
        "state": "rule:state.board_cell",
        "topology": "rule:topology.board",
        "coordinate": {
          "op": "literal",
          "value": [
            10,
            10
          ]
        },
        "value": {
          "op": "literal",
          "value": 2
        }
      },
      {
        "op": "grid.set",
        "state": "rule:state.board_cell",
        "topology": "rule:topology.board",
        "coordinate": {
          "op": "literal",
          "value": [
            5,
            5
          ]
        },
        "value": {
          "op": "literal",
          "value": -1
        }
      }
    ],
    "entity_types": [],
    "information_model": "perfect"
  },
  "queries": [],
  "events": [],
  "actions": [
    {
      "id": "rule:action.move_up",
      "name": "Move Up",
      "actor": {
        "op": "literal",
        "value": "rule:participant.human.player"
      },
      "verb": "control",
      "target": {
        "kind": "source_defined"
      },
      "parameters": [],
      "preconditions": {
        "op": "literal",
        "value": true
      },
      "effects": [
        {
          "op": "grid.set",
          "state": "rule:state.board_cell",
          "topology": "rule:topology.board",
          "coordinate": {
            "op": "literal",
            "value": [
              10,
              11
            ]
          },
          "value": {
            "op": "literal",
            "value": 2
          }
        }
      ],
      "timing": {
        "phase": "rule:phase.input"
      },
      "executable": true,
      "semantic_status": "proven",
      "precondition": {
        "op": "literal",
        "value": true
      },
      "encoding": {
        "kind": "none"
      }
    },
    {
      "id": "rule:action.move_down",
      "name": "Move Down",
      "actor": {
        "op": "literal",
        "value": "rule:participant.human.player"
      },
      "verb": "control",
      "target": {
        "kind": "source_defined"
      },
      "parameters": [],
      "preconditions": {
        "op": "literal",
        "value": true
      },
      "effects": [
        {
          "op": "grid.set",
          "state": "rule:state.board_cell",
          "topology": "rule:topology.board",
          "coordinate": {
            "op": "literal",
            "value": [
              10,
              9
            ]
          },
          "value": {
            "op": "literal",
            "value": 2
          }
        }
      ],
      "timing": {
        "phase": "rule:phase.input"
      },
      "executable": true,
      "semantic_status": "proven",
      "precondition": {
        "op": "literal",
        "value": true
      },
      "encoding": {
        "kind": "none"
      }
    },
    {
      "id": "rule:action.move_left",
      "name": "Move Left",
      "actor": {
        "op": "literal",
        "value": "rule:participant.human.player"
      },
      "verb": "control",
      "target": {
        "kind": "source_defined"
      },
      "parameters": [],
      "preconditions": {
        "op": "literal",
        "value": true
      },
      "effects": [
        {
          "op": "grid.set",
          "state": "rule:state.board_cell",
          "topology": "rule:topology.board",
          "coordinate": {
            "op": "literal",
            "value": [
              9,
              10
            ]
          },
          "value": {
            "op": "literal",
            "value": 2
          }
        }
      ],
      "timing": {
        "phase": "rule:phase.input"
      },
      "executable": true,
      "semantic_status": "proven",
      "precondition": {
        "op": "literal",
        "value": true
      },
      "encoding": {
        "kind": "none"
      }
    },
    {
      "id": "rule:action.move_right",
      "name": "Move Right",
      "actor": {
        "op": "literal",
        "value": "rule:participant.human.player"
      },
      "verb": "control",
      "target": {
        "kind": "source_defined"
      },
      "parameters": [],
      "preconditions": {
        "op": "literal",
        "value": true
      },
      "effects": [
        {
          "op": "grid.set",
          "state": "rule:state.board_cell",
          "topology": "rule:topology.board",
          "coordinate": {
            "op": "literal",
            "value": [
              11,
              10
            ]
          },
          "value": {
            "op": "literal",
            "value": 2
          }
        }
      ],
      "timing": {
        "phase": "rule:phase.input"
      },
      "executable": true,
      "semantic_status": "proven",
      "precondition": {
        "op": "literal",
        "value": true
      },
      "encoding": {
        "kind": "none"
      }
    }
  ],
  "systems": [],
  "flow": {
    "model": "fixed_tick",
    "phases": [
      {
        "id": "rule:phase.input",
        "order": 100
      },
      {
        "id": "rule:phase.update",
        "order": 200
      }
    ],
    "initial_phase": "rule:phase.input",
    "scheduler": {
      "clock": "event_queue",
      "tick_hz": 8,
      "ordering": "phase_priority_id"
    },
    "turn_order": []
  },
  "random_streams": [],
  "goals": [],
  "outcomes": [],
  "modes": [
    {
      "id": "rule:mode.default",
      "name": "Default",
      "overrides": []
    }
  ],
  "invariants": [],
  "extensions": {},
  "provenance": {
    "patch_history": [
      {
        "base_revision": 0,
        "base_content_hash": "9ba7c8c8637ec5efa2ad84fe8c645c6bcf2595b0ab4f9ca6774f219e34a38d01",
        "evidence": [
          {
            "evidence_id": "ev:param.source_tick_ms.0",
            "path": "snake.py",
            "kind": "static",
            "supports": "/rule_ir/flow",
            "confidence": 0.8,
            "file_sha256": "085015d8aaa06f484df9ce0361fa4438981aecd8e1dc14ea0ba3ba744583b7dd",
            "span": {
              "line_start": 277,
              "line_end": 277
            }
          }
        ],
        "assumptions": [],
        "operation_count": 5
      }
    ]
  },
  "unresolved": []
}
