{
  "ir_version": "cubeengine.rule-ir/2.0-alpha.1",
  "document_id": "rule:game.tictactoe_3d",
  "revision": 0,
  "content_hash": "",
  "metadata": {
    "title": "3D Tic-Tac-Toe Rule Contract",
    "description": "Deterministic two-player 3x3x3 placement rules used to prove generic 3D AlphaZero compilation.",
    "source_project_hash": "",
    "determinism": "deterministic"
  },
  "dependencies": {"scene_ir": null, "asset_ir": null, "input_ir": null, "extensions": []},
  "parameters": [],
  "types": [
    {
      "id": "rule:type.cell_state",
      "name": "Cell State",
      "kind": "enum",
      "values": {"negative": -1, "empty": 0, "positive": 1}
    }
  ],
  "participants": [
    {"id": "rule:participant.positive", "name": "Positive", "kind": "human_or_agent"},
    {"id": "rule:participant.negative", "name": "Negative", "kind": "human_or_agent"}
  ],
  "topologies": [
    {
      "id": "rule:topology.board",
      "name": "3D Board",
      "kind": "rect_grid",
      "anchor": "cell",
      "axes": [
        {"name": "x", "extent": 3, "boundary": "bounded"},
        {"name": "y", "extent": 3, "boundary": "bounded"},
        {"name": "z", "extent": 3, "boundary": "bounded"}
      ],
      "neighborhoods": []
    }
  ],
  "state": {
    "variables": [
      {
        "id": "rule:state.board_cell",
        "name": "Board Cell",
        "type": "rule:type.cell_state",
        "scope": "topology_site",
        "topology": "rule:topology.board",
        "initial": {"op": "literal", "value": 0}
      }
    ],
    "entity_types": [
      {
        "id": "rule:entity.positive_mark",
        "name": "Positive Mark",
        "components": [
          {"name": "legacy_state_value", "type": "core:int", "default": {"op": "literal", "value": 1}}
        ],
        "legacy": {"owner": "rule:participant.positive", "state_value": 1}
      },
      {
        "id": "rule:entity.negative_mark",
        "name": "Negative Mark",
        "components": [
          {"name": "legacy_state_value", "type": "core:int", "default": {"op": "literal", "value": -1}}
        ],
        "legacy": {"owner": "rule:participant.negative", "state_value": -1}
      }
    ],
    "initial_effects": [],
    "information_model": "perfect"
  },
  "queries": [],
  "events": [],
  "actions": [
    {
      "id": "rule:action.place",
      "name": "Place Mark",
      "actor": {"op": "ref", "path": "flow.current_actor"},
      "parameters": [
        {
          "name": "target",
          "type": "core:coord",
          "domain": {
            "op": "call",
            "function": "core:topology.sites",
            "args": [{"op": "literal", "value": "rule:topology.board"}]
          }
        }
      ],
      "precondition": {
        "op": "call",
        "function": "core:grid.equals",
        "args": [
          {"op": "literal", "value": "rule:state.board_cell"},
          {"op": "param", "name": "target"},
          {"op": "literal", "value": 0}
        ]
      },
      "effects": [
        {
          "op": "grid.set",
          "state": "rule:state.board_cell",
          "topology": "rule:topology.board",
          "coordinate": {"op": "param", "name": "target"},
          "value": {
            "op": "call",
            "function": "core:participant.state",
            "args": [{"op": "ref", "path": "flow.current_actor"}]
          }
        }
      ],
      "timing": {"phase": "rule:phase.input"},
      "encoding": {"kind": "parameter_product", "parameters": ["target"], "ordering": "lexicographic"}
    }
  ],
  "systems": [],
  "flow": {
    "model": "turn_based",
    "phases": [
      {"id": "rule:phase.input", "order": 100},
      {"id": "rule:phase.outcome", "order": 200}
    ],
    "initial_phase": "rule:phase.input",
    "scheduler": {"clock": "turn", "tick_hz": null, "ordering": "phase_priority_id"},
    "turn_order": ["rule:participant.positive", "rule:participant.negative"]
  },
  "random_streams": [],
  "goals": [{"id": "rule:goal.line_three", "name": "Form a length-three spatial line"}],
  "outcomes": [
    {
      "id": "rule:outcome.positive_win",
      "name": "Positive Wins",
      "priority": 100,
      "condition": {
        "op": "call", "function": "core:grid.has_line",
        "args": [
          {"op": "literal", "value": "rule:state.board_cell"},
          {"op": "literal", "value": 1},
          {"op": "literal", "value": 3}
        ]
      },
      "result": {
        "status": "win", "terminal": true,
        "winners": [{"op": "literal", "value": "rule:participant.positive"}],
        "losers": [{"op": "literal", "value": "rule:participant.negative"}]
      }
    },
    {
      "id": "rule:outcome.negative_win",
      "name": "Negative Wins",
      "priority": 100,
      "condition": {
        "op": "call", "function": "core:grid.has_line",
        "args": [
          {"op": "literal", "value": "rule:state.board_cell"},
          {"op": "literal", "value": -1},
          {"op": "literal", "value": 3}
        ]
      },
      "result": {
        "status": "win", "terminal": true,
        "winners": [{"op": "literal", "value": "rule:participant.negative"}],
        "losers": [{"op": "literal", "value": "rule:participant.positive"}]
      }
    },
    {
      "id": "rule:outcome.draw",
      "name": "Draw",
      "priority": 10,
      "condition": {
        "op": "call", "function": "core:grid.none_equal",
        "args": [
          {"op": "literal", "value": "rule:state.board_cell"},
          {"op": "literal", "value": 0}
        ]
      },
      "result": {"status": "draw", "terminal": true}
    }
  ],
  "modes": [{"id": "rule:mode.default", "name": "Default", "overrides": []}],
  "invariants": [
    {
      "id": "rule:invariant.cell_domain",
      "name": "Cell values remain in the declared enum",
      "condition": {
        "op": "call", "function": "core:grid.values_in_type",
        "args": [
          {"op": "literal", "value": "rule:state.board_cell"},
          {"op": "literal", "value": "rule:type.cell_state"}
        ]
      },
      "severity": "error"
    }
  ],
  "extensions": {},
  "provenance": {
    "/topologies/0": [{"author": "engineer", "method": "conformance_fixture", "confidence": 1.0}],
    "/actions/0": [{"author": "engineer", "method": "conformance_fixture", "confidence": 1.0}],
    "/outcomes": [{"author": "engineer", "method": "conformance_fixture", "confidence": 1.0}]
  },
  "unresolved": []
}
